{
  "contracts": [
    {
      "contract": "split_repository_recorded_benchmark_v1",
      "definition_sha256": "fa0889fb632a5856ec8c86a87c2c3e4f305409d927eb31b492198ea3990fbd1a",
      "evaluator_commit": "00730f4226ee4f4818abcdf38033b368a247d63b"
    },
    {
      "contract": "split_repository_recorded_benchmark_v1",
      "definition_sha256": "fa0889fb632a5856ec8c86a87c2c3e4f305409d927eb31b492198ea3990fbd1a",
      "evaluator_commit": "01b49497799cfa9110c136dae1c3ca7651d4593d"
    },
    {
      "contract": "split_repository_recorded_benchmark_v1",
      "definition_sha256": "c311d49b030dcfc4cdcda7e41ece7749a05158d46a01abaf5b607abbabda8735",
      "evaluator_commit": "01d448c46dec91d111fb0649b6cb9fa542d89128"
    },
    {
      "contract": "split_repository_recorded_benchmark_v1",
      "definition_sha256": "7a40ba508f8da9ace2ac2bcb487274f7ada0f461744a700c9cda1a86077b379e",
      "evaluator_commit": "01f64b97180801f6da7da10e61ee54c68e3c6bb7"
    },
    {
      "contract": "split_repository_recorded_benchmark_v1",
      "definition_sha256": "fa0889fb632a5856ec8c86a87c2c3e4f305409d927eb31b492198ea3990fbd1a",
      "evaluator_commit": "07683f73e7fae1fdd5afcc4b4d3bb8670e897cc1"
    },
    {
      "contract": "split_repository_recorded_benchmark_v1",
      "definition_sha256": "e14dd7a28ca829e17132da4267e8b16b1db564bfa853296a1142022989a91a23",
      "evaluator_commit": "07cd096f4f3953e2fa3f8735082bbeab818b6429"
    },
    {
      "contract": "split_repository_recorded_benchmark_v1",
      "definition_sha256": "1d0650f3821f066e93f0b8432b2cecad43ffd8c0a9a66c3eb977422aeb356587",
      "evaluator_commit": "0995de7b0c1dee33be1f7cbceebe0d400363d842"
    },
    {
      "contract": "split_repository_recorded_benchmark_v1",
      "definition_sha256": "c311d49b030dcfc4cdcda7e41ece7749a05158d46a01abaf5b607abbabda8735",
      "evaluator_commit": "0bf88bf0e29c6f2abe8fe07aed1ab803ce98f2ec"
    },
    {
      "contract": "split_repository_recorded_benchmark_v1",
      "definition_sha256": "ba851933ac8a333fc9cc26eea813a82ffb585069b682ac28d123cd0214cc679b",
      "evaluator_commit": "0e1cb218b0e715963b51f3b2d624b8e505181cfa"
    },
    {
      "contract": "split_repository_recorded_benchmark_v1",
      "definition_sha256": "7b15e22709ba65f73fcc953a778fd1de7d95552e25c52be9fa99693089b573f5",
      "evaluator_commit": "1021dba0a1d78b07cb03a7e4e4d7163ef4083a37"
    },
    {
      "contract": "split_repository_recorded_benchmark_v1",
      "definition_sha256": "fa0889fb632a5856ec8c86a87c2c3e4f305409d927eb31b492198ea3990fbd1a",
      "evaluator_commit": "1106e8c0077d4da920baf7a5b6c8f8d2a430acba"
    },
    {
      "contract": "split_repository_recorded_benchmark_v1",
      "definition_sha256": "7b5794fd605ae7fcbb4e9b3984414d364c0b3081a0f87dd0ec90fa5973aed0e0",
      "evaluator_commit": "1221b841ffc41a50d696129dae280308d3f3970d"
    },
    {
      "contract": "split_repository_recorded_benchmark_v1",
      "definition_sha256": "7a40ba508f8da9ace2ac2bcb487274f7ada0f461744a700c9cda1a86077b379e",
      "evaluator_commit": "171d426ae49284e0bc6f24abe2c24af226445486"
    },
    {
      "contract": "split_repository_recorded_benchmark_v1",
      "definition_sha256": "d8685a08f6a4c5e6b95913e6f906ef4a9364cce360dc862841118d56dc773c1a",
      "evaluator_commit": "177847f5b1b59c07c63b024a2ab0d7af99cfd623"
    },
    {
      "contract": "split_repository_recorded_benchmark_v1",
      "definition_sha256": "ba851933ac8a333fc9cc26eea813a82ffb585069b682ac28d123cd0214cc679b",
      "evaluator_commit": "17ef113b885881b1e1c8ec3b57db9e4ac93646b7"
    },
    {
      "contract": "split_repository_recorded_benchmark_v1",
      "definition_sha256": "d8685a08f6a4c5e6b95913e6f906ef4a9364cce360dc862841118d56dc773c1a",
      "evaluator_commit": "19be05743fd5264152fce621c5051b6180406e60"
    },
    {
      "contract": "split_repository_recorded_benchmark_v1",
      "definition_sha256": "fa0889fb632a5856ec8c86a87c2c3e4f305409d927eb31b492198ea3990fbd1a",
      "evaluator_commit": "204d4e3fb4b49dc76c934fa2b6b171fe79e08d66"
    },
    {
      "contract": "split_repository_recorded_benchmark_v1",
      "definition_sha256": "3dc721027f5c5560a6de1453971bfd078fc65c821e81f8b05ff4ed10ef0eba3a",
      "evaluator_commit": "2220b0f2b339ee2dc005d16a19f63b0b64d6ae7c"
    },
    {
      "contract": "split_repository_recorded_benchmark_v1",
      "definition_sha256": "7a40ba508f8da9ace2ac2bcb487274f7ada0f461744a700c9cda1a86077b379e",
      "evaluator_commit": "22c14385c3acdb7f7323828d9d4410f36a3bd7f3"
    },
    {
      "contract": "split_repository_recorded_benchmark_v1",
      "definition_sha256": "7a40ba508f8da9ace2ac2bcb487274f7ada0f461744a700c9cda1a86077b379e",
      "evaluator_commit": "23fffa773f05fb6b19fc7c0cc6edf7f73e38aba4"
    },
    {
      "contract": "split_repository_recorded_benchmark_v1",
      "definition_sha256": "ba851933ac8a333fc9cc26eea813a82ffb585069b682ac28d123cd0214cc679b",
      "evaluator_commit": "29b8d921b7321c939196b18c2be4967ec86d9e9e"
    },
    {
      "contract": "split_repository_recorded_benchmark_v1",
      "definition_sha256": "d8685a08f6a4c5e6b95913e6f906ef4a9364cce360dc862841118d56dc773c1a",
      "evaluator_commit": "2b0fb39e247d2b81c54d43b9a9172e177deb2764"
    },
    {
      "contract": "split_repository_recorded_benchmark_v1",
      "definition_sha256": "ba851933ac8a333fc9cc26eea813a82ffb585069b682ac28d123cd0214cc679b",
      "evaluator_commit": "2b2c46102015c38d37a137a4533a21d9018011bb"
    },
    {
      "contract": "split_repository_recorded_benchmark_v1",
      "definition_sha256": "d8685a08f6a4c5e6b95913e6f906ef4a9364cce360dc862841118d56dc773c1a",
      "evaluator_commit": "2c69297fe98ea569eb141b2b7af04c3cb331d64a"
    },
    {
      "contract": "split_repository_recorded_benchmark_v1",
      "definition_sha256": "d8685a08f6a4c5e6b95913e6f906ef4a9364cce360dc862841118d56dc773c1a",
      "evaluator_commit": "2e46e516589d4cc6a205b56855580e3d860fc253"
    },
    {
      "contract": "split_repository_recorded_benchmark_v1",
      "definition_sha256": "fa0889fb632a5856ec8c86a87c2c3e4f305409d927eb31b492198ea3990fbd1a",
      "evaluator_commit": "3749005630adb8264875593270abd5c9e312d090"
    },
    {
      "contract": "split_repository_recorded_benchmark_v1",
      "definition_sha256": "fa0889fb632a5856ec8c86a87c2c3e4f305409d927eb31b492198ea3990fbd1a",
      "evaluator_commit": "3930106dea1fa9878f0f5c17a06e2d1e6212f0cf"
    },
    {
      "contract": "split_repository_recorded_benchmark_v1",
      "definition_sha256": "7b15e22709ba65f73fcc953a778fd1de7d95552e25c52be9fa99693089b573f5",
      "evaluator_commit": "39b257650e5868c5c6f62d2fe5f2075a97734a59"
    },
    {
      "contract": "split_repository_recorded_benchmark_v1",
      "definition_sha256": "7a40ba508f8da9ace2ac2bcb487274f7ada0f461744a700c9cda1a86077b379e",
      "evaluator_commit": "39fa63039b5c24f0a654dc9ecf2015b9f8267713"
    },
    {
      "contract": "split_repository_recorded_benchmark_v1",
      "definition_sha256": "fa0889fb632a5856ec8c86a87c2c3e4f305409d927eb31b492198ea3990fbd1a",
      "evaluator_commit": "3ac5658558e80bc996b3eb60087afe4acbdf56cc"
    },
    {
      "contract": "split_repository_recorded_benchmark_v1",
      "definition_sha256": "d8685a08f6a4c5e6b95913e6f906ef4a9364cce360dc862841118d56dc773c1a",
      "evaluator_commit": "3b80ea5c81cbe1c128507ad98eac6182bd5b4504"
    },
    {
      "contract": "split_repository_recorded_benchmark_v1",
      "definition_sha256": "7a40ba508f8da9ace2ac2bcb487274f7ada0f461744a700c9cda1a86077b379e",
      "evaluator_commit": "3c1312199b150b1777e205a3efc33f1652fdc81e"
    },
    {
      "contract": "split_repository_recorded_benchmark_v1",
      "definition_sha256": "1d0650f3821f066e93f0b8432b2cecad43ffd8c0a9a66c3eb977422aeb356587",
      "evaluator_commit": "3d5da9082dd6fb718c5e5cc8f78c8ee6641bc1a7"
    },
    {
      "contract": "split_repository_recorded_benchmark_v1",
      "definition_sha256": "fa0889fb632a5856ec8c86a87c2c3e4f305409d927eb31b492198ea3990fbd1a",
      "evaluator_commit": "43a9c2a127ac9929ffce5ff44e2a7f8bd51f1522"
    },
    {
      "contract": "split_repository_recorded_benchmark_v1",
      "definition_sha256": "d8685a08f6a4c5e6b95913e6f906ef4a9364cce360dc862841118d56dc773c1a",
      "evaluator_commit": "43affdfdc28fe436b0fde1d12410536c3b50c8be"
    },
    {
      "contract": "split_repository_recorded_benchmark_v1",
      "definition_sha256": "fa0889fb632a5856ec8c86a87c2c3e4f305409d927eb31b492198ea3990fbd1a",
      "evaluator_commit": "4489a1b133984d6f4531de9dfbe3c810981c97bb"
    },
    {
      "contract": "split_repository_recorded_benchmark_v1",
      "definition_sha256": "ba851933ac8a333fc9cc26eea813a82ffb585069b682ac28d123cd0214cc679b",
      "evaluator_commit": "45f5fe615beed039a8954d1b6c354968581688b9"
    },
    {
      "contract": "split_repository_recorded_benchmark_v1",
      "definition_sha256": "fa0889fb632a5856ec8c86a87c2c3e4f305409d927eb31b492198ea3990fbd1a",
      "evaluator_commit": "4709d253d70ddc2e13b582821936583f417696fe"
    },
    {
      "contract": "split_repository_recorded_benchmark_v1",
      "definition_sha256": "c311d49b030dcfc4cdcda7e41ece7749a05158d46a01abaf5b607abbabda8735",
      "evaluator_commit": "47afc601e4d891303049d951dd64db69477e333f"
    },
    {
      "contract": "split_repository_recorded_benchmark_v1",
      "definition_sha256": "e14dd7a28ca829e17132da4267e8b16b1db564bfa853296a1142022989a91a23",
      "evaluator_commit": "4bcfce4099b7359d83704cd8d042b74d2fa9e223"
    },
    {
      "contract": "split_repository_recorded_benchmark_v1",
      "definition_sha256": "fa0889fb632a5856ec8c86a87c2c3e4f305409d927eb31b492198ea3990fbd1a",
      "evaluator_commit": "4d7918c5977ee2f816b9419369b6b554f7d3d3d9"
    },
    {
      "contract": "split_repository_recorded_benchmark_v1",
      "definition_sha256": "d8685a08f6a4c5e6b95913e6f906ef4a9364cce360dc862841118d56dc773c1a",
      "evaluator_commit": "4fc63abfef377fea9a1050c2f0c3c1115e3cb362"
    },
    {